{
  "id": "b2e4f6a8-1c3d-4e5f-8a9b-0c1d2e3f4a5b",
  "image_id": "img_7f3a9c21e4b0",
  "total_count": 6,
  "abnormal_count": 1,
  "rectangles_counted": 2,
  "concentration": 3000.0,
  "confidence": 0.9,
  "cells": [
    {
      "x": 158,
      "y": 288,
      "label": "normal",
      "score": 0.94
    },
    {
      "x": 208,
      "y": 308,
      "label": "normal",
      "score": 0.91
    },
    {
      "x": 248,
      "y": 358,
      "label": "normal",
      "score": 0.88
    },
    {
      "x": 311,
      "y": 296,
      "label": "abnormal",
      "score": 0.82
    },
    {
      "x": 338,
      "y": 338,
      "label": "normal",
      "score": 0.97
    },
    {
      "x": 298,
      "y": 368,
      "label": "normal",
      "score": 0.9
    }
  ],
  "model_version": "fake-0.1"
}
